[
{"id":202,"source":"coffeetrail","checked_at":"2026-09-28T12:00:00+03:00","confidence":0.95,"facts":{"business_status":"operational","phone":"058-4345278","regular_hours_json":["Su 09:00-13:00","Mo 09:00-13:00","Tu 10:00-15:00","We 09:00-13:00","Th 10:00-15:00","Fr 09:00-13:00"]}},
{"id":228,"source":"coffeetrail","checked_at":"2026-09-28T12:00:00+03:00","confidence":0.95,"facts":{"business_status":"operational","phone":"054-493-9011","regular_hours_json":["Tu 09:00-18:00","We 09:00-18:00","Th 09:00-18:00","Fr 09:00-18:00","Sa 09:00-18:00"]}},
{"id":357,"source":"tourgolan","checked_at":"2026-09-28T12:00:00+03:00","confidence":0.95,"facts":{"business_status":"operational","phone":"058-455-9312","regular_hours_json":["Su 09:00-19:00","Mo 09:00-19:00","Tu 09:00-19:00","We 09:00-19:00","Th 09:00-19:00","Fr 09:00-15:00"]}},
{"id":409,"source":"tourgolan","checked_at":"2026-09-28T12:00:00+03:00","confidence":0.95,"facts":{"business_status":"operational","phone":"04-676-3535"}}
]
